{"contract_version":"0.1.0","run_id":"adl-20260831","created_at":"2026-08-20T14:26:39Z","seed":20260831,"config_hash":"e37a35d8120307070ffe52ad1cfc7fc2d861645212d09c047a11528d654f43f0","code_version":"d43fede92c26681a9e00ddd8b4033ca6440fb14f","prevalence":0.010047,"is_fixture":false,"baseline":{"name":"logistic_regression_transaction_only","features":["amount_inr","log_amount","hour_of_day","day_of_week","channel_code","mcc_code","auth_declined","geography_matches_home","account_age_days","device_age_days"],"metrics":{"prevalence":0.01071290944123314,"precision":0.0768,"recall":0.7626,"f1":0.1396,"auc_roc":0.9231,"auc_pr":0.1455,"alert_rate":0.10636,"net_value_protected_inr":10566598.6,"scoring_latency_p50_ms":null,"scoring_latency_p99_ms":null,"lift_over_baseline":null}},"generations":[{"generation":0,"n_vectors":5,"n_transactions":300000,"n_fraud":3014,"metrics_seen":{"prevalence":0.01071290944123314,"precision":0.8664,"recall":0.9101,"f1":0.8877,"auc_roc":0.9978,"auc_pr":0.9515,"alert_rate":0.01125,"net_value_protected_inr":13279004.9,"scoring_latency_p50_ms":6.229,"scoring_latency_p99_ms":21.118,"lift_over_baseline":{"auc_pr":554.0,"recall":19.3,"precision":1028.1,"f1":535.9,"net_value_protected_inr":25.7}},"metrics_unseen":{"prevalence":0.01071290944123314,"precision":0.8664,"recall":0.9101,"f1":0.8877,"auc_roc":0.9978,"auc_pr":0.9515,"alert_rate":0.01125,"net_value_protected_inr":13279004.9,"scoring_latency_p50_ms":6.229,"scoring_latency_p99_ms":21.118,"lift_over_baseline":{"auc_pr":554.0,"recall":19.3,"precision":1028.1,"f1":535.9,"net_value_protected_inr":25.7}},"ablation":[{"variant":"txn_only","metrics":{"prevalence":0.01071290944123314,"precision":0.7579,"recall":0.777,"f1":0.7673,"auc_roc":0.9954,"auc_pr":0.8624,"alert_rate":0.01098,"net_value_protected_inr":11903591.13,"scoring_latency_p50_ms":null,"scoring_latency_p99_ms":null,"lift_over_baseline":{"auc_pr":492.7,"recall":1.9,"precision":886.8,"f1":449.6,"net_value_protected_inr":12.7}}},{"variant":"txn+session","metrics":{"prevalence":0.01071290944123314,"precision":0.8664,"recall":0.9101,"f1":0.8877,"auc_roc":0.9978,"auc_pr":0.9515,"alert_rate":0.01125,"net_value_protected_inr":13279004.9,"scoring_latency_p50_ms":6.229,"scoring_latency_p99_ms":21.118,"lift_over_baseline":{"auc_pr":554.0,"recall":19.3,"precision":1028.1,"f1":535.9,"net_value_protected_inr":25.7}}},{"variant":"all_levels_minus_coercion_signal","metrics":{"prevalence":0.01071290944123314,"precision":0.8678,"recall":0.9209,"f1":0.8935,"auc_roc":0.9979,"auc_pr":0.9572,"alert_rate":0.01137,"net_value_protected_inr":13275754.48,"scoring_latency_p50_ms":null,"scoring_latency_p99_ms":null,"lift_over_baseline":{"auc_pr":557.9,"recall":20.8,"precision":1029.9,"f1":540.0,"net_value_protected_inr":25.6}}},{"variant":"all_levels_minus_cadence_signal","metrics":{"prevalence":0.01071290944123314,"precision":0.8846,"recall":0.9101,"f1":0.8972,"auc_roc":0.9973,"auc_pr":0.9572,"alert_rate":0.01102,"net_value_protected_inr":13087362.16,"scoring_latency_p50_ms":null,"scoring_latency_p99_ms":null,"lift_over_baseline":{"auc_pr":557.9,"recall":19.3,"precision":1051.8,"f1":542.7,"net_value_protected_inr":23.9}}}],"detection_rate":0.9737,"n_chains_proposed":0,"n_chains_rejected":0}],"fidelity":{"discriminator_auc":null,"comparable_columns":["amount_inr","hour_of_day","mcc","channel","auth_result"],"excluded_columns":["sess_n_events","sess_duration_ms","sess_cadence_cv","sess_cadence_entropy","sess_paste_ratio_payee","sess_confirm_dwell_ms","sess_correction_rate","sess_n_declines","sess_max_gap_ms"],"reference_profiles":[{"name":"ieee_cis","serves_channels":["cards_cnp","wallets_tokenisation"],"available":false},{"name":"paysim","serves_channels":["upi_instant","bank_transfer","merchant_payouts"],"available":false}],"ks_per_column":null,"psi_per_column":null,"correlation_delta_frobenius":null},"cost_model":{"review_cost_inr":250.0,"currency":"INR"},"artefacts":{"attacks":"attacks.json","ledger_dir":"ledger/","demo_slice":"demo_slice.json","misses":["misses.g0.json"],"graph_snapshot":null}}
